{
  "$id": "qvra-family-2-execution-bridge-design.schema.json",
  "$schema": "https://json-schema.org/draft/2020-12/schema",
  "additionalProperties": false,
  "properties": {
    "benchmark": {
      "const": "entity-resolution-ambiguity-v1"
    },
    "bindings": {
      "additionalProperties": false,
      "properties": {
        "activation": {
          "additionalProperties": false,
          "properties": {
            "immutable": {
              "const": true
            },
            "merged_main": {
              "const": "8f58bf509cc7e9ad138b088a8c92af54a09e4a36"
            },
            "path": {
              "const": "protocols/entity-resolution-ambiguity-execution-activation-v1.json"
            },
            "reviewed_head": {
              "const": "6aef28b98e1c5fe7d6935ce01366b5197a08737f"
            },
            "sha256": {
              "const": "d418c4d21865f50c7a1d949777d22dca793eb51a79965bfa941017f892f2f2ea"
            }
          },
          "required": [
            "immutable",
            "merged_main",
            "path",
            "reviewed_head",
            "sha256"
          ],
          "type": "object"
        },
        "authorization_sha256": {
          "const": "30890b1ac027caf4c3175e6c602581ad3c9e544d932435bff045884b795e5728"
        },
        "command_descriptor_sha256": {
          "const": "817d3e1eae8babb26eb49792b5778898793235042020c9f904cad0057e8549ac"
        },
        "controller_binding_attestation_sha256": {
          "const": "f11beabbbd55b9f36ab924fcd767e985eee3e218d70a5520047997b4e3cb6f57"
        },
        "controller_sha256": {
          "const": "2b9e0026ed756468432c8d07edca9ebc49ef3b727defbc39f3b55cb9319d9661"
        },
        "governed_main": {
          "const": "8f58bf509cc7e9ad138b088a8c92af54a09e4a36"
        },
        "permit_sha256": {
          "const": "7cef4548b571940a2fe34e3a4025afe8fe632a90c4af38b9fbd00b1b5794a8d3"
        },
        "portable_plan_sha256": {
          "const": "df1fbeab0a2c89c16fb9530aaf4f5545d62a4dab3f44f160dacdc231a3463ac7"
        },
        "process_launcher_sha256": {
          "const": "d8d028d95adb463f27b5df6a5ec44ae9049b6799aae46c4b0176ca2adfd07f90"
        }
      },
      "required": [
        "activation",
        "authorization_sha256",
        "command_descriptor_sha256",
        "controller_binding_attestation_sha256",
        "controller_sha256",
        "governed_main",
        "permit_sha256",
        "portable_plan_sha256",
        "process_launcher_sha256"
      ],
      "type": "object"
    },
    "bridge_kind": {
      "const": "exact-one-shot-nine-run-execution-bridge"
    },
    "execution_order_contract": {
      "additionalProperties": false,
      "properties": {
        "launches_must_match_portable_plan": {
          "const": true
        },
        "run_order": {
          "const": [
            1,
            2,
            3
          ]
        },
        "system_order": {
          "const": [
            "qvra-native-er-v1",
            "splink-4.0.17",
            "dedupe-3.0.3"
          ]
        },
        "total_launches": {
          "const": 9
        }
      },
      "required": [
        "launches_must_match_portable_plan",
        "run_order",
        "system_order",
        "total_launches"
      ],
      "type": "object"
    },
    "family": {
      "const": 2
    },
    "future_implementation_contract": {
      "additionalProperties": false,
      "properties": {
        "module_path": {
          "const": "suites/entity-resolution-ambiguity-v1/execution_bridge.py"
        },
        "must_capture_stderr": {
          "const": true
        },
        "must_capture_stdout": {
          "const": true
        },
        "must_complete_all_raw_runs_before_scoring": {
          "const": true
        },
        "must_forbid_retuning": {
          "const": true
        },
        "must_forbid_runtime_mutation": {
          "const": true
        },
        "must_forbid_truth_input": {
          "const": true
        },
        "must_hash_raw_outputs_before_truth_reveal": {
          "const": true
        },
        "must_refuse_partial_execution": {
          "const": true
        },
        "must_refuse_second_execution": {
          "const": true
        },
        "must_require_exact_nine_run_topology": {
          "const": true
        },
        "must_require_network_disabled": {
          "const": true
        },
        "must_retain_failed_runs": {
          "const": true
        },
        "must_retain_raw_outputs": {
          "const": true
        },
        "must_verify_activation_identity": {
          "const": true
        },
        "must_verify_controller_identity": {
          "const": true
        },
        "must_verify_launcher_identity": {
          "const": true
        },
        "must_verify_permit_identity": {
          "const": true
        },
        "must_verify_portable_plan_identity": {
          "const": true
        }
      },
      "required": [
        "module_path",
        "must_capture_stderr",
        "must_capture_stdout",
        "must_complete_all_raw_runs_before_scoring",
        "must_forbid_retuning",
        "must_forbid_runtime_mutation",
        "must_forbid_truth_input",
        "must_hash_raw_outputs_before_truth_reveal",
        "must_refuse_partial_execution",
        "must_refuse_second_execution",
        "must_require_exact_nine_run_topology",
        "must_require_network_disabled",
        "must_retain_failed_runs",
        "must_retain_raw_outputs",
        "must_verify_activation_identity",
        "must_verify_controller_identity",
        "must_verify_launcher_identity",
        "must_verify_permit_identity",
        "must_verify_portable_plan_identity"
      ],
      "type": "object"
    },
    "governance_gate": {
      "additionalProperties": false,
      "properties": {
        "execution_requires_separate_explicit_run_step": {
          "const": true
        },
        "implementation_requires_exact_head_review": {
          "const": true
        },
        "implementation_requires_independent_review": {
          "const": true
        },
        "implementation_requires_mainline_merge": {
          "const": true
        },
        "implementation_requires_separate_commit": {
          "const": true
        }
      },
      "required": [
        "execution_requires_separate_explicit_run_step",
        "implementation_requires_exact_head_review",
        "implementation_requires_independent_review",
        "implementation_requires_mainline_merge",
        "implementation_requires_separate_commit"
      ],
      "type": "object"
    },
    "implementation_boundary": {
      "additionalProperties": false,
      "properties": {
        "bridge_design_created": {
          "const": true
        },
        "bridge_execution_capability_present": {
          "const": false
        },
        "bridge_implementation_created": {
          "const": false
        },
        "controller_mutation_performed": {
          "const": false
        },
        "launcher_execution_authorized": {
          "const": false
        },
        "launcher_mutation_performed": {
          "const": false
        },
        "process_launch_enabled": {
          "const": false
        },
        "subprocess_invocation": {
          "const": false
        }
      },
      "required": [
        "bridge_design_created",
        "bridge_execution_capability_present",
        "bridge_implementation_created",
        "controller_mutation_performed",
        "launcher_execution_authorized",
        "launcher_mutation_performed",
        "process_launch_enabled",
        "subprocess_invocation"
      ],
      "type": "object"
    },
    "preexecution_state": {
      "additionalProperties": false,
      "properties": {
        "activation_consumed": {
          "const": false
        },
        "permit_consumed": {
          "const": false
        },
        "quality_result_available": {
          "const": false
        },
        "raw_runs_produced": {
          "const": 0
        },
        "system_execution": {
          "const": false
        },
        "truth_scoring": {
          "const": false
        }
      },
      "required": [
        "activation_consumed",
        "permit_consumed",
        "quality_result_available",
        "raw_runs_produced",
        "system_execution",
        "truth_scoring"
      ],
      "type": "object"
    },
    "schema": {
      "const": "qvra-family-2-execution-bridge-design/v1"
    },
    "scope": {
      "additionalProperties": false,
      "properties": {
        "all_nine_runs_required": {
          "const": true
        },
        "run_numbers": {
          "const": [
            1,
            2,
            3
          ]
        },
        "runs_per_system": {
          "const": 3
        },
        "systems": {
          "const": [
            "qvra-native-er-v1",
            "splink-4.0.17",
            "dedupe-3.0.3"
          ]
        },
        "total_required_raw_runs": {
          "const": 9
        }
      },
      "required": [
        "all_nine_runs_required",
        "run_numbers",
        "runs_per_system",
        "systems",
        "total_required_raw_runs"
      ],
      "type": "object"
    }
  },
  "required": [
    "benchmark",
    "bindings",
    "bridge_kind",
    "execution_order_contract",
    "family",
    "future_implementation_contract",
    "governance_gate",
    "implementation_boundary",
    "preexecution_state",
    "schema",
    "scope"
  ],
  "type": "object"
}
